<?xml version="1.0" encoding="UTF-8"?>
<!--
To change this license header, choose License Headers in Project Properties.
To change this template file, choose Tools | Templates
and open the template in the editor.
-->
<!--<!DOCTYPE Library SYSTEM "LibraryDTD.dtd">--> 

<Library xmlns:xsi="http://www.w3.org/2001/XMLSchema-instance" 
         xsi:noNamespaceSchemaLocation="librarySchema.xsd"
    >

    <librarian name=""/>
    <location country=""/>
    <desc describtion=""/>
    <book title="dfgr" ISBN="4564646525">
        <Author name="fdg"/>
        <preface>
            lknkl
        </preface>
        <part title="dfg">
            <chapter title="dfg">
                <summary>
                    lkjl
                </summary>
                <section>
                    <paragraph>
                        ljlk
                    </paragraph>
                </section> 
            </chapter>
        </part>
    </book>
</Library>
